{
  "year": 2021,
  "title": "2021 Keynotes",
  "department": "MS Data Visualization",
  "description": "",

  "location": "Online",
  "date": "",
  "time": "",
  "url": "",

  "students": [],
  "video_source_url": "https://player.vimeo.com/video/545201647",
  "video_embed_html": "<iframe src=\"https://player.vimeo.com/video/545201647\" width=\"640\" height=\"360\" frameborder=\"0\" allow=\"autoplay; fullscreen; picture-in-picture\" allowfullscreen></iframe>"
}
