{
  "year": 2022,
  "title": "2022 Keynotes",
  "department": "MS Data Visualization",
  "description": "",

  "location": "Online",
  "date": "2022-05-18",
  "time": "5:00PM",
  "url": "",

  "students": [
    "Molly Cook",
    "Juliet Craig",
    "Gísli Gudjónsson",
    "Jiahui(Jessie) Han",
    "Yann Kerblat",
    "Yoana Kosturska",
    "Baihan Lin",
    "Wenqin Lu",
    "Shea Molloy",
    "Omar Nema",
    "Jeremy Odell",
    "Kasey Zhuravlev"
  ],
 "video_source_url": "https://github.com/visualizedata/archive/raw/main/app/assets/media/2022keynotes.mp4",
 "video_embed_html": "<video autoplay controls muted preload='auto' src='https://github.com/visualizedata/archive/raw/main/app/assets/media/2022keynotes.mp4'></video>"
}
