{
  "year": 2023,
  "title": "2023 Keynotes",
  "department": "MS Data Visualization",
  "description": "",
  "location": "",
  "date": "2023-05-17",
  "time": "6:00PM",
  "url": "",
  "students": [
    "Isabel Bonnet",
    "Stephanie Dang",
    "Angelica Hom",
    "Zora Wan",
    "Hao Lun Hung",
    "Tatiana Lahera Kalainoff",
    "Asad Ahmad Khan",
    "Jooyoung Lee",
    "Tina Titus Mathew",
    "Huong Pham",
    "Alix Maissa Scherer",
    "Ladfah Suwichacherdchu",
    "Chay Thawaranont",
    "Tanishia Williams",
    "Shuyao Xiao"
  ],
  "video_source_url": "",
  "video_embed_html": ""
}
